<?xml version="1.0" encoding="UTF-8"?>
<tns:DecisionTree xmlns:tns="http://bryanreinero.com/hum/"
	xmlns:xsi="http://www.w3.org/2001/XMLSchema-instance"
	xsi:schemaLocation="http://bryanreinero.com/hum/HUMConfiguration.xsd ">
	<tns:Deterministic>
		<tns:If>
			<tns:Or>
			 <tns:Compare op="seq" >
			     <tns:Value>assert</tns:Value>
			     <tns:Value>assert</tns:Value>
			 </tns:Compare>
			</tns:Or>
			<tns:Path id="1" weight="0">
			    <tns:ResponseHeader>
			     <tns:Name>Content-Type</tns:Name>
			     <tns:Value><![CDATA[text/html]]></tns:Value>
			     </tns:ResponseHeader>
			     <tns:ResponseHeader>
                 <tns:Name>Special</tns:Name>
                 <tns:Value><![CDATA[blah]]></tns:Value>
                 </tns:ResponseHeader>
				<tns:ResponseBody><![CDATA[this is the requested URL: ]]><tns:RequestURL/></tns:ResponseBody>
			</tns:Path>
		</tns:If>
	</tns:Deterministic>
</tns:DecisionTree>
