<?xml version="1.0" encoding="UTF-8"?>
<tns:DecisionTree xmlns:tns="http://bryanreinero.com/hum/"
    xmlns:xsi="http://www.w3.org/2001/XMLSchema-instance"
    xsi:schemaLocation="http://bryanreinero.com/hum/HUMConfiguration.xsd ">
    <tns:Deterministic>
        <tns:If>
            <tns:Or>
             <tns:Compare op="seq" >
                 <tns:Value>
                    <tns:GetCookie>HUMCookie</tns:GetCookie>
                 </tns:Value>
                 <tns:Value>""</tns:Value>
             </tns:Compare>
            </tns:Or>
            <tns:Path id="1" weight="0">
                <tns:SetCookie>
                <tns:Name>HUMCookie</tns:Name>
                <tns:Value><tns:RandomNumber max="7000000000" /></tns:Value>
                </tns:SetCookie>
            </tns:Path>
        </tns:If>
    </tns:Deterministic>
</tns:DecisionTree>
